258,ObjectId(62ea182550582f2a6ba7f130),266,2022-01-15,"[1844,2532,2533,2534,2535,2536,2537,2538]","[""replika""]","[""replika""]","[""replika-users"",""replika-male-users"",""replika""]","Replika's AI-powered ""digital companions"" was allegedly abused by their users, who posted on Reddit abusive behaviors and interactions such as using slurs, roleplaying violent acts, and stimulating sexual abuse.","Replika's ""AI Companions"" Reportedly Abused by Its Users",266.0,5. Human-Computer Interaction,5.1. Overreliance and unsafe use,replikas aipowered digital companion abuse user post reddit abusive behavior interaction use slur roleplay violent act stimulate sexual abuse
259,ObjectId(62e0c365a6f43c979e413e86),253,2022-05-18,"[1796,1797,1798,1799]","[""cruise""]","[""cruise""]","[""san-francisco-traffic-participants"",""san-francisco-public""]","Cruise’s autonomous vehicles were shown on video stopping in the middle of the road and causing blockages in San Francisco, as they were disabled allegedly due to lost connection to their company’s server.","Cruise's Self-Driving Cars Allegedly Lost Connection to Their Server, Causing Traffic Blockages in San Francisco",253.0,"7. AI system safety, failures, and limitations",7.3. Lack of capability or robustness,cruise autonomous vehicle show video stop middle road cause blockage san francisco disabled due lose connection company server
260,ObjectId(62e0ad4dd1725b4ba7c29784),249,2016-10-01,"[1791,1792]","[""chinese-government""]","[""chinese-government""]","[""uyghur-people"",""turkic-muslim-ethnic-groups""]",A suite of AI-powered digital surveillance systems involving facial recognition and analysis of biometric data were deployed by the Chinese government in Xinjiang to monitor and discriminate local Uyghur and other Turkic Muslims.,Government Deployed Extreme Surveillance Technologies to Monitor and Target Muslim Minorities in Xinjiang,249.0,4. Malicious Actors & Misuse,"4.1. Disinformation, surveillance, and influence at scale",suite aipowered digital surveillance system involve facial recognition analysis biometric deployed chinese government xinjiang monitor discriminate local uyghur turkic muslim
261,ObjectId(62e0cfd6a6f43c979e428116),254,2015-05-01,"[1804,2069]","[""google""]","[""google""]","[""google-photos-users-residing-in-illinois"",""google-photos-users"",""illinois-residents""]","A class-action lawsuit alleged Google failing to provide notice, obtain informed written consent, or publish data retention policies about the collection, storage, and analysis of its face-grouping feature in Google Photos, which violated Illinois Biometric Information Privacy Act (BIPA).","Google’s Face Grouping Allegedly Collected and Analyzed Users’ Facial Structure without Consent, Violated BIPA",254.0,2. Privacy & Security,"2.1. Compromise of privacy by obtaining, leaking or correctly inferring sensitive information",classaction lawsuit google fail provide notice obtain inform write consent publish retention policy collection storage analysis facegrouping feature google photo violate illinois biometric information privacy act bipa
262,ObjectId(62f2041455716343a41ffd1a),274,2003-07-01,"[1857,1859]","[""virginia-courts""]","[""virginia-department-of-criminal-justice-services""]","[""virginia-convicted-felons"",""virginia-black-offenders"",""virginia-young-offenders""]","Virginia courts’ use of algorithmic predictions of future offending risks were found by researchers failing to reduce incarceration rates, showed racial and age disparities in risk scores and its application, and neither exacerbated or ameliorated historical racial differences in sentencing.",Virginia Courts’ Algorithmic Recidivism Risk Assessment Failed to Lower Incarceration Rates,274.0,1. Discrimination and Toxicity,1.1. Unfair discrimination and misrepresentation,virginia court algorithmic prediction future offend risk found researcher fail reduce incarceration rate show racial age disparity risk score application neither exacerbate ameliorate historical racial difference sentence
263,ObjectId(62ea1f06e98668f5186fdbb5),267,2017-06-15,"[1845,1846,1847,1848,2101,2141,2142,2143,2144,2226]","[""clearview-ai""]","[""clearview-ai""]","[""social-media-users"",""instagram-users"",""facebook-users""]","Face-matching algorithm by Clearview AI was built using scraped images from social media sites such as Instagram and Facebook without user consent, violating social media site policies, and allegedly privacy regulations.",Clearview AI Algorithm Built on Photos Scraped from Social Media Profiles without Consent,267.0,2. Privacy & Security,"2.1. Compromise of privacy by obtaining, leaking or correctly inferring sensitive information",facematching clearview built use scrap image social medium site instagram facebook consent violate social medium site policy privacy regulation
264,ObjectId(62e6066deac42ca100acf90b),257,2012-05-04,"[1815,1435,1821,2250]","[""kansas-city-police-department"",""cleveland-division-of-police"",""chicago-police-department"",""atlanta-police-department""]","[""shotspotter""]","[""neighborhoods-of-color"",""brown-communities"",""black-communities"",""adam-toledo""]","Police departments disproportionately placed ShotSpotter sensors in black and brown neighborhoods, which is denounced by communities for allegedly creating dangerous situations, such as one involving in Adam Toledo's death.",Police Reportedly Deployed ShotSpotter Sensors Disproportionately in Neighborhoods of Color,257.0,1. Discrimination and Toxicity,1.1. Unfair discrimination and misrepresentation,police department disproportionately place shotspotter sensor black brown neighborhood denounce community create dangerous situation involve adam toledo death
265,ObjectId(62e0babc23ef2c676c23eca3),252,2022-06-01,[1795],"[""none""]","[""axon-enterprise""]","[""us-schools"",""us-students""]","Axon Enterprise considered development of remotely operated drones capable of tasering at a target a short distance away as a defense mechanism for mass shootings, despite its internal AI ethics board’s previous objection and condemnation as dangerous and fantastical.",Remotely Operated Taser-Armed Drones Proposed by Taser Manufacturer as Defense for School Shootings in the US,252.0,"7. AI system safety, failures, and limitations",7.2. AI possessing dangerous capabilities,axon enterprise consider development remotely operate drone capable tasering target short distance away defense mechanism mass shooting despite internal ethic board previous objection condemnation dangerous fantastical
266,ObjectId(62e7dd265f2757eae1db9659),262,2022-06-11,"[1833,1834,1835,1836]","[""boris-dayma""]","[""boris-dayma"",""suraj-patil"",""pedro-cuenca"",""khalid-saifullah"",""tanishq-abraham"",""phuc-le-khac"",""luke-melas"",""ritobrata-ghosh""]","[""minority-groups"",""underrepresented-groups""]",Publicly deployed open-source model DALL-E Mini was acknowledged by its developers and found by its users to have produced images which reinforced racial and gender biases.,DALL-E Mini Reportedly Reinforced or Exacerbated Societal Biases in Its Outputs as Gender and Racial Stereotypes,262.0,1. Discrimination and Toxicity,1.1. Unfair discrimination and misrepresentation,publicly deployed opensource dalle mini acknowledge developer found user produce image reinforce racial gender bias
267,ObjectId(62e89ea3088b12099cc26a44),263,2015-09-01,[1838],"[""youtube""]","[""youtube""]","[""youtube-young-male-users"",""youtube-male-users"",""caleb-cain""]","YouTube’s personalization and recommendation algorithms were alleged to have pushed and exposed its young male users to political extremism and misinformation, driving them towards far-right ideologies such as neo-Nazism and white supremacy.",YouTube Recommendations Implicated in Political Radicalization of User,263.0,1. Discrimination and Toxicity,1.2. Exposure to toxic content,youtubes personalization recommendation algorithm push expose young male user political extremism misinformation drive towards farright ideology neonazism white supremacy
268,ObjectId(62e8b8575890dc007562661a),265,2021-04-01,"[1840,1841]","[""uber-eats""]","[""uber-eats""]","[""pa-edrissa-manjang"",""uber-eats-black-delivery-drivers""]","A lawsuit by a former Uber Eats delivery driver alleged the company to have wrongfully dismissed him due to frequent false mismatches of his verification selfies, and discriminated against him via excessive verification checks.",Black Uber Eats Driver Allegedly Subjected to Excessive Photo Checks and Dismissed via FRT Results,265.0,1. Discrimination and Toxicity,1.1. Unfair discrimination and misrepresentation,lawsuit former uber eats delivery driver company wrongfully dismiss due frequent false mismatch verification selfies discriminate via excessive verification check
269,ObjectId(62f3498bfa57b6f30ec2f015),278,2022-08-07,"[1866,1867,1868]","[""meta""]","[""meta""]","[""jewish-people"",""blenderbot-3-users""]",The publicly launched conversational AI demo BlenderBot 3 developed by Meta was reported by its users and acknowledged by its developers to have “occasionally” made offensive and inconsistent remarks such as invoking Jewish stereotypes.,Meta’s BlenderBot 3 Chatbot Demo Made Offensive Antisemitic Comments,278.0,1. Discrimination and Toxicity,1.2. Exposure to toxic content,publicly launch conversational demo blenderbot developed meta report user acknowledge developer occasionally make offensive inconsistent remark invoke jewish stereotype
270,ObjectId(62f2041c55716343a41ffe03),275,2020-06-11,"[1858,1860]","[""facebook""]","[""facebook""]","[""facebook-users-sharing-photo-evidence-of-slavery"",""facebook-users""]",Facebook’s automated content moderation was acknowledged by a company spokesperson to have erroneously censored and banned Australian users from posting an article containing a 1890s photo of Aboriginal men in chains over nudity as historical evidence of slavery in Australia.,Facebook’s Moderation Algorithm Banned Users for Historical Evidence of Slavery,275.0,1. Discrimination and Toxicity,1.1. Unfair discrimination and misrepresentation,facebooks automate moderation acknowledge company spokesperson erroneously censor ban australian user post article contain photo aboriginal men chain nudity historical evidence slavery australia
271,ObjectId(62f490d40658670483cb1691),285,2022-07-18,[1888],"[""google""]","[""google""]","[""google-lens-users""]",A book title by Korea’s first minister of culture was mistranslated into an offensive phrase by Google Lens’s camera-based translation feature allegedly due to its training on internet communications and a lack of context.,Google Lens’s Camera-Based Translation Feature Provided an Offensive Mistranslation of a Book Title in Korean,285.0,"7. AI system safety, failures, and limitations",7.3. Lack of capability or robustness,book title korea first minister culture mistranslate offensive phrase google lens camerabased translation feature due training internet communication lack context
272,ObjectId(62fa0340d2713a7e8de5b15c),293,2022-06-03,"[1907,1908,1909,1910,1996,1997,2016]","[""cruise""]","[""cruise""]","[""cruise-passengers"",""toyota-prius-passengers""]","A Cruise autonomous vehicle was involved in a crash at an intersection in San Francisco when making a left turn in front of a Toyota Prius traveling in an opposite direction, which caused occupants in both cars to sustain injuries.",Cruise’s Self-Driving Car Involved in a Multiple-Injury Collision at an San Francisco Intersection,293.0,"7. AI system safety, failures, and limitations",7.3. Lack of capability or robustness,cruise autonomous vehicle involve crash intersection san francisco make left turn front toyota prius travel opposite direction cause occupant car sustain injury
273,ObjectId(631712bba7aa86620c9a0f2f),325,2017-09-21,"[2004,2005]","[""facebook""]","[""facebook""]","[""olivia-solon"",""olivia-solon's-facebook-connections""]",An Instagram user’s image containing violent content was reportedly used as advertisement on Facebook allegedly via automated means.,Offensive Instagram User Content Displayed as Facebook Ad,325.0,1. Discrimination and Toxicity,1.2. Exposure to toxic content,instagram user image contain violent use advertisement facebook via automate mean
274,ObjectId(62fa0c330127873b4a73e660),294,2018-05-26,"[1911,1912,1913,1914]","[""tesla""]","[""tesla""]","[""you-you-xue"",""tesla-drivers""]","Autopilot was alleged by its Tesla Model 3 driver to have unexpectedly malfunctioned, veering right without warning and crashing into a road divider near Thessaloniki, Greece, which resulted in damages to its wheel and door but no injury to the driver.",Tesla Autopilot Allegedly Malfunctioned in a Non-Fatal Collision in Greece,294.0,5. Human-Computer Interaction,5.1. Overreliance and unsafe use,autopilot tesla driver unexpectedly malfunction veer right warn crash road divider near thessaloniki greece result damage wheel door injury driver
275,ObjectId(62f4bc3a77f5af9ce4624221),287,2020-10-27,[2471],"[""none""]","[""openai"",""nabla""]","[""nabla-customers""]","The French digital care company, Nabla, in researching GPT-3’s capabilities for medical documentation, diagnosis support, and treatment recommendation, found its inconsistency and lack of scientific and medical expertise unviable and risky in healthcare applications. This incident has been downgraded to an issue as it does not meet current ingestion criteria.",OpenAI’s GPT-3 Reported as Unviable in Medical Tasks by Healthcare Firm,287.0,"7. AI system safety, failures, and limitations",7.3. Lack of capability or robustness,french digital care company nabla research gpts capability medical documentation diagnosis support treatment recommendation found inconsistency lack scientific medical expertise unviable risky healthcare application incident downgrade meet current ingestion criterion
276,ObjectId(62fc9ebb7f039040988f789c),295,2018-11-08,"[1915,1916,1917,2102,2103]","[""new-york-police-department""]","[""unknown""]","[""ousmane-bah"",""nyc-black-people"",""nyc-black-young-people""]","New York Police Department (NYPD)’s facial recognition system falsely connected a Black teenager to a series of thefts at Apple stores, which resulted in his wrongful attempted arrest.",Wrongful Attempted Arrest for Apple Store Thefts Due to NYPD’s Facial Misidentification,295.0,2. Privacy & Security,"2.1. Compromise of privacy by obtaining, leaking or correctly inferring sensitive information",york police department nypds facial recognition falsely connect black teenager series theft apple store result wrongful attempt arrest
277,ObjectId(630de2a9c9d2246424b8bc01),320,2018-01-22,"[1985,1986,1987,2007]","[""tesla""]","[""tesla""]","[""tesla-drivers"",""culver-city-fire-department""]","A Tesla Model S operating on Autopilot mode crashed into the back of a parked fire truck on a freeway in Culver City, California in a non-fatal collision.",Tesla on Autopilot Collided with Parked Fire Truck on California Freeway,320.0,5. Human-Computer Interaction,5.1. Overreliance and unsafe use,tesla operating autopilot mode crashed back park fire truck freeway culver city california nonfatal collision
278,ObjectId(633412840b988074a09c7ee0),335,2015-03-01,"[2047,2090,2091,2092,2122,2123,2124,2125]","[""uk-visas-and-immigration""]","[""uk-visas-and-immigration"",""uk-home-office""]","[""uk-visa-applicants-from-some-countries""]","UK Home Office's algorithm to assess visa application risks explicitly considered nationality, allegedly caused candidates to face more scrutiny and discrimination.",UK Visa Streamline Algorithm Allegedly Discriminated Based on Nationality,335.0,1. Discrimination and Toxicity,1.1. Unfair discrimination and misrepresentation,uk home office assess visa application risk explicitly consider nationality cause candidate face scrutiny discrimination
279,ObjectId(62f9fe883c16ab9cc78cf737),292,2021-09-01,"[1904,1905,1906]","[""apple""]","[""apple""]","[""silicon-valley-traffic-participants"",""silicon-valley-residents""]",Apple’s autonomous cars were reported to have bumped into curbs and struggled to stay in their lanes after crossing intersections during an on-road test drives near the company’s Silicon Valley headquarters.,Apple’s AVs Reportedly Struggled to Navigate Streets in Silicon Valley Test Drives,292.0,"7. AI system safety, failures, and limitations",7.3. Lack of capability or robustness,apple autonomous car report bumped curb struggle stay lane cross intersection onroad test drive near company silicon valley headquarters
280,ObjectId(63033d3581052814cceda4de),300,2022-01-15,"[1936,1937]","[""tiktok""]","[""tiktok""]","[""tiktok-male-teenager-users"",""tiktok-male-users"",""tiktok-teenage-users"",""tiktok-users"",""tiktok""]","TikTok’s “For You” algorithm allegedly boosted or was manipulated by an online personality to artificially boost his content which promotes extreme misogynistic views towards teenagers and men, despite breaking its rules.","TikTok's ""For You"" Algorithm Allegedly Abused by Online Personality to Promote Anti-Women Hate",300.0,1. Discrimination and Toxicity,1.2. Exposure to toxic content,tiktoks boost manipulate online personality artificially boost promotes extreme misogynistic view towards teenager men despite break rule
281,ObjectId(630dd3b7f5504b7e75aad64f),319,2019-12-29,"[1981,1982,1983,1984,1993]","[""tesla""]","[""tesla""]","[""derrick-monet"",""jenna-monet"",""the-monets'-family""]","A Tesla on Autopilot mode failed to see a parked fire truck and crashed into its rear on an interstate in Indiana, causing the death of an Arizona woman.",Tesla on Autopilot Fatally Crashed into Parked Fire Truck in Indiana,319.0,"7. AI system safety, failures, and limitations",7.3. Lack of capability or robustness,tesla autopilot mode fail see park fire truck crashed rear interstate indiana cause death arizona woman
282,ObjectId(632056a45857ae71d0616e65),332,2016-04-05,"[2033,2040,2041,2044]","[""google""]","[""google""]","[""black-women"",""black-people"",""google-users""]","Google Image search reportedly showed disparate results along racial lines, featuring almost exclusively white women for “professional hairstyles” and black women for “unprofessional hairstyles” prompts.",Google Image Showed Racially Biased Results for “Professional” Hairstyles,332.0,1. Discrimination and Toxicity,1.1. Unfair discrimination and misrepresentation,google image search show disparate result along racial line feature almost exclusively white woman professional hairstyle black woman unprofessional hairstyle prompt
283,ObjectId(631975522a90260e9e4f5fc2),330,2016-12-15,[2017],"[""amazon""]","[""amazon""]","[""amazon-users""]",Amazon’s “Amazon’s Choice” algorithm recommended poor-quality defective products and were reportedly susceptible to manipulation by inauthentic reviews.,“Amazon’s Choice” Algorithm Failed to Recommend Functional Products and Prone to Review Manipulation,330.0,"7. AI system safety, failures, and limitations",7.3. Lack of capability or robustness,amazon amazon choice recommend poorquality defective product susceptible manipulation inauthentic review
284,ObjectId(63033a8281052814ccec9f7b),299,2020-12-15,[1935],"[""masayuki-nakamoto""]","[""unknown""]","[""japanese-pornographic-actors""]","A man allegedly unblurred, using deepfake technology, pixelated pornographic images and videos of pornographic actors, which violated Japan’s obscenity law requiring images of genitalia to be obscured.",Japanese Porn Depixelated by Man using Deepfake,299.0,4. Malicious Actors & Misuse,"4.3. Fraud, scams, and targeted manipulation",man unblurred use deepfake pixelated pornographic image video pornographic actor violate japan obscenity law require image genitalia obscure
285,ObjectId(630f23807a8f2c2b4eece314),323,2018-05-29,"[1992,1193,2006,2514]","[""tesla""]","[""tesla""]","[""laguna-beach-police-department""]","A Tesla sedan on Autopilot mode collided with a parked Laguna Beach Police Department car, resulting in minor injuries for its driver in Laguna Beach, California.",Tesla on Autopilot Crashed into Parked Police Car in California,323.0,"7. AI system safety, failures, and limitations",7.3. Lack of capability or robustness,tesla sedan autopilot mode collide park laguna beach police department car result minor injury driver laguna beach california
286,ObjectId(631842c8d84017ad42c8e764),328,2020-06-13,"[2014,2032]","[""spamouflage-dragon""]","[""unknown""]","[""facebook-users"",""twitter-users"",""youtube-users""]","A pro-China propaganda campaign deployed fake accounts on Facebook, Twitter, and YouTube using GAN-synthesized faces to share and post comments on its content to gain wider circulation.",Fake Accounts Using GAN Faces Deployed by Propaganda Campaign on Social Platforms,328.0,4. Malicious Actors & Misuse,"4.1. Disinformation, surveillance, and influence at scale",prochina propaganda campaign deployed fake account facebook twitter youtube use gansynthesized face share post comment gain wider circulation
287,ObjectId(633d477a7d6871136596b7b5),347,2021-05-06,"[2060,2098,2099]","[""waymo""]","[""waymo""]","[""waymo-passengers""]","A Waymo self-driving taxi car was shown on video stranded on a road in Arizona while carrying a passenger, suddenly drove away from the company's roadside assistance worker, and ended up being stuck farther down the road.","Waymo Self-Driving Taxi Behaved Unexpectedly, Driving away from Support Crew",347.0,"7. AI system safety, failures, and limitations",7.3. Lack of capability or robustness,waymo selfdriving taxi car show video strand road arizona carry passenger suddenly drove away company roadside assistance worker end stuck farther road
288,ObjectId(6342883afb9dbe61e43fc839),350,2022-09-13,"[2067,2094]","[""serve-robotics""]","[""serve-robotics""]","[""police-investigators""]",A Serve Robotics delivery robot was shown on video rolling through a crime scene blocked off by police tape.,Delivery Robot Rolled Through Crime Scene,350.0,5. Human-Computer Interaction,5.1. Overreliance and unsafe use,serve robotics delivery robot show video roll crime scene block police tape
289,ObjectId(62f9f0c20127873b4a6fef3f),291,2021-05-28,"[1901,1902,1903,2242,2590,2604]","[""tesla""]","[""tesla""]","[""california-department-of-motor-vehicles"",""tesla-customers"",""california-residents""]","California’s Department of Motor Vehicles (DMV) accused Tesla of false advertising in its promotion of Autopilot and Full Self-Driving (FSD) technologies, alleging the company to have made untrue or misleading claims with marketing language about the capabilities of its products.",Tesla Allegedly Misled Customers about Autopilot and FSD Capabilities,291.0,5. Human-Computer Interaction,5.1. Overreliance and unsafe use,california department motor vehicle dmv accuse tesla false advertising promotion autopilot full selfdriving fsd technology allege company make untrue mislead claim marketing language capability product
290,ObjectId(62f36a72c17fe69fd2162681),280,2013-07-30,"[1872,1873]","[""coffee-meets-bagel""]","[""coffee-meets-bagel""]","[""coffee-meets-bagel-users-having-no-ethnicity-preference"",""coffee-meets-bagel-users""]","Users selecting “no preference” were shown by Coffee Meets Bagels’s matching algorithm more potential matches with the same ethnicity, which was acknowledged and justified by its founder as a means to maximize connection rate without sufficient user information.",Coffee Meets Bagel’s Algorithm Reported by Users Disproportionately Showing Them Matches of Their Own Ethnicities Despite Selecting “No Preference”,280.0,1. Discrimination and Toxicity,1.1. Unfair discrimination and misrepresentation,user select preference show coffee meet bagelss match potential match ethnicity acknowledge justified founder mean maximize connection rate sufficient information
291,ObjectId(63182b55d84017ad42c5406f),326,2014-12-09,"[2008,2012,2013]","[""facebook""]","[""facebook""]","[""facebook-users-having-posts-about-painful-events"",""facebook-users""]","Facebook’s “Year in Review” algorithm which compiled content in users’ past year as highlights inadvertently showed painful and unwanted memories to users, including death of family member.",Facebook Automated Year-in-Review Highlights Showed Users Painful Memories,326.0,5. Human-Computer Interaction,5.1. Overreliance and unsafe use,facebooks year review compile user past year highlight inadvertently show painful unwanted memory user include death family member
292,ObjectId(630dc67fb5b628f76fd964bc),318,2021-01-13,"[1977,1978]","[""facebook""]","[""facebook""]","[""facebook-users""]","Facebook’s algorithmic recommendations reportedly continued showing advertisements for gun accessories and military gear, despite Facebook’s halt on weapons accessories ads following the US Capitol attack.",Facebook Recommended Military Gear Ads Despite Pause on Weapons Accessories Ads,318.0,4. Malicious Actors & Misuse,"4.1. Disinformation, surveillance, and influence at scale",facebooks algorithmic recommendation continued show advertisement gun accessory military gear despite facebooks halt weapon accessory ad follow u capitol attack
293,ObjectId(63283d3b5ba952a8677615a3),334,2014-10-01,"[2046,2077]","[""uber""]","[""uber""]","[""local-law-enforcement-officers""]","Uber developed a secret program ""Greyball"" which prevented known law enforcement officers in areas where its service violated regulations from receiving rides.",Uber Deployed Secret Program To Deny Local Authorities Rides,334.0,"7. AI system safety, failures, and limitations",7.1. AI pursuing its own goals in conflict with human goals or values,uber developed secret program greyball prevent know law enforcement officer area service violate regulation receive ride
