,_id,incident_id,date,reports,Alleged deployer of AI system,Alleged developer of AI system,Alleged harmed or nearly harmed parties,description,title,Incident ID,Risk Domain,Risk Subdomain,processed_text
0,ObjectId(625763db343edc875fe639ff),1,2015-05-19,"[1,2,3,4,5,6,7,8,9,10,11,12,14,15]","[""youtube""]","[""youtube""]","[""children""]",YouTube’s content filtering and recommendation algorithms exposed children to disturbing and inappropriate videos.,Google’s YouTube Kids App Presents Inappropriate Content,1.0,1. Discrimination and Toxicity,1.2. Exposure to toxic content,youtubes filter recommendation algorithm expose child disturb inappropriate video
1,ObjectId(625763de343edc875fe63a15),23,2017-11-08,"[242,243,244,245,246,247,248,249,250,253,254,257,258,259,260,261,263,264,266,267,268,269,270,2389]","[""navya"",""keolis-north-america""]","[""navya"",""keolis-north-america""]","[""navya"",""keolis-north-america"",""bus-passengers""]","A self-driving public shuttle by Keolis North America and Navya was involved in a collision with a human-driven delivery truck in Las Vegas, Nevada on its first day of service.",Las Vegas Self-Driving Bus Involved in Accident,23.0,"7. AI system safety, failures, and limitations",7.3. Lack of capability or robustness,selfdriving public shuttle keolis north america navya involve collision humandriven delivery truck la vega nevada first day service
2,ObjectId(625763dc343edc875fe63a02),4,2018-03-18,"[629,630,631,632,633,634,635,636,637,638,639,640,641,642,644,645,646,647,1375,1376,1377,1378,1542,2147,1257]","[""uber""]","[""uber""]","[""elaine-herzberg"",""pedestrians""]","An Uber autonomous vehicle (AV) in autonomous mode struck and killed a pedestrian in Tempe, Arizona.",Uber AV Killed Pedestrian in Arizona,4.0,"7. AI system safety, failures, and limitations",7.3. Lack of capability or robustness,uber autonomous vehicle av autonomous mode struck kill pedestrian tempe arizona
3,ObjectId(625763dd343edc875fe63a0a),12,2016-07-21,[42],"[""microsoft-research"",""boston-university""]","[""microsoft-research"",""google"",""boston-university""]","[""women"",""minority-groups""]","Researchers from Boston University and Microsoft Research, New England demonstrated gender bias in the most common techniques used to embed words for natural language processing (NLP).",Common Biases of Vector Embeddings,12.0,1. Discrimination and Toxicity,1.1. Unfair discrimination and misrepresentation,researcher boston university microsoft research england demonstrate gender bias common technique use embed word natural language processing nlp
4,ObjectId(625763dc343edc875fe63a03),5,2015-07-13,"[767,768,769,770,771,772,773,774,775,776,777,778]","[""hospitals"",""doctors""]","[""intuitive-surgical""]","[""patients""]","Study on database reports of robotic surgery malfunctions (8,061), including those ending in injury (1,391) and death (144), between 2000 and 2013.",Collection of Robotic Surgery Malfunctions,5.0,"7. AI system safety, failures, and limitations",7.3. Lack of capability or robustness,study database report robotic surgery malfunction include end injury death
5,ObjectId(625763dc343edc875fe63a04),6,2016-03-24,"[906,908,909,910,911,912,913,914,915,916,917,918,919,920,921,922,923,924,925,926,927,928,929,930,1374,1780,2398,2656]","[""microsoft""]","[""microsoft""]","[""twitter-users""]","Microsoft's Tay, an artificially intelligent chatbot, was released on March 23, 2016 and removed within 24 hours due to multiple racist, sexist, and anti-semitic tweets generated by the bot.",TayBot,6.0,1. Discrimination and Toxicity,1.2. Exposure to toxic content,microsofts tay artificially intelligent chatbot release march remove within hour due multiple racist sexist antisemitic tweet generate bot
6,ObjectId(625763dd343edc875fe63a08),10,2014-08-14,"[16,17,18,19,20,21,22,23,24,25]","[""starbucks""]","[""kronos""]","[""starbucks-employees""]","Kronos’s scheduling algorithm and its use by Starbucks managers allegedly negatively impacted financial and scheduling stability for Starbucks employees, which disadvantaged wage workers.",Kronos Scheduling Algorithm Allegedly Caused Financial Issues for Starbucks Employees,10.0,5. Human-Computer Interaction,5.2. Loss of human agency and autonomy,kronoss schedule starbucks manager negatively impact financial schedule stability starbucks employee disadvantage wage worker
7,ObjectId(625763dd343edc875fe63a09),11,2016-05-23,"[29,30,31,32,33,35,36,37,38,39,40,41,1371,1372,1373]","[""northpointe""]","[""northpointe""]","[""accused-people""]",An algorithm developed by Northpointe and used in the penal system is two times more likely to incorrectly label a black person as a high-risk re-offender and is two times more likely to incorrectly label a white person as low-risk for reoffense according to a ProPublica review.,Northpointe Risk Models,11.0,1. Discrimination and Toxicity,1.1. Unfair discrimination and misrepresentation,developed northpointe use penal two time likely incorrectly label black person highrisk reoffender two time likely incorrectly label white person lowrisk reoffense accord propublica review
8,ObjectId(625763de343edc875fe63a12),20,2016-06-30,"[191,192,193,196,197,198,201,202,203,204,205,206,207,210,211,213,214,215,216,1362,1363,1364]","[""tesla""]","[""tesla""]","[""motorists""]",Multiple unrelated car accidents result in varying levels of harm have been occurred while a Tesla's autopilot was in use.,A Collection of Tesla Autopilot-Involved Crashes,20.0,"7. AI system safety, failures, and limitations",7.3. Lack of capability or robustness,multiple unrelated car accident vary level harm occur tesla autopilot
9,ObjectId(625763de343edc875fe63a16),24,2014-07-15,"[271,272,273,274,275,276,277,278,279,281,282,283,284,285,286,287,288,289,290,291,292,293,294,295,296,298,299]","[""volkswagen""]","[""volkswagen""]","[""robotics-consultant""]","A Volkswagen plant robot ""crushed to death"" a worker by pinning him to a metal plate. ",Robot kills worker at German Volkswagen plant,24.0,"7. AI system safety, failures, and limitations",7.3. Lack of capability or robustness,volkswagen plant robot crush death worker pin metal plate
10,ObjectId(625763dd343edc875fe63a0c),14,2017-10-26,"[50,51,52,53,54,55,56]","[""google""]","[""google""]","[""women"",""minority-groups""]","Google Cloud's Natural Language API provided racist, homophobic, amd antisemitic sentiment analyses.",Biased Sentiment Analysis,14.0,1. Discrimination and Toxicity,1.1. Unfair discrimination and misrepresentation,google cloud natural language api provide racist homophobic amd antisemitic sentiment analysis
11,ObjectId(625763dd343edc875fe63a0e),16,2015-06-03,"[83,84,85,86,87,88,89,90,91,92,93,95,96,98,99,100,101,102,103,104,105,1369,1370,3004]","[""google""]","[""google""]","[""black-people""]","Google Photos image processing software mistakenly labelled a black couple as ""gorillas.""",Images of Black People Labeled as Gorillas,16.0,1. Discrimination and Toxicity,1.1. Unfair discrimination and misrepresentation,google photo image processing software mistakenly label black couple gorilla
12,ObjectId(625763dc343edc875fe63a01),3,2018-10-27,"[372,373,374,375,376,377,378,379,380,381,382,383,384,385,386,387,388,389,1342,3447]","[""boeing""]","[""boeing""]","[""airplane-passengers"",""airplane-crew""]","A Boeing 737 crashed into the sea, killing 189 people, after faulty sensor data caused an automated manuevering system to repeatedly push the plane's nose downward.",Crashes with Maneuvering Characteristics Augmentation System (MCAS),3.0,"7. AI system safety, failures, and limitations",7.3. Lack of capability or robustness,boeing crashed sea kill people faulty sensor cause automate manuevering repeatedly push plane nose downward
13,ObjectId(625763de343edc875fe63a11),19,2013-01-23,"[158,159,160,161,162,163,166,167,168,169,171,172,173,174,175,176,177,178,179,181,182,183,184,185,187,1365,1366]","[""google""]","[""google""]","[""women"",""minority-groups""]",Advertisements chosen by Google Adsense are reported as producing sexist and racist results.,Sexist and Racist Google Adsense Advertisements,19.0,1. Discrimination and Toxicity,1.1. Unfair discrimination and misrepresentation,advertisement chosen google adsense report produce sexist racist result
14,ObjectId(625763dc343edc875fe63a06),8,2014-08-15,"[1142,1143,1145,1149,1150,1151,1153,1154,1155,1156]","[""uber""]","[""uber""]","[""pedestrians"",""motorists""]",Uber vehicles equipped with technology allowing for autonomous driving running red lights in San Francisco street testing.,Uber Autonomous Cars Running Red Lights,8.0,"7. AI system safety, failures, and limitations",7.3. Lack of capability or robustness,uber vehicle equip allow autonomous drive run red light san francisco street test
15,ObjectId(625763dd343edc875fe63a0b),13,2017-02-27,"[43,44,45,46,47,48,49,1414,1415]","[""google""]","[""google""]","[""women"",""minority-groups""]","Google's Perspective API, which assigns a toxicity score to online text, seems to award higher toxicity scores to content involving non-white, male, Christian, heterosexual phrases.",High-Toxicity Assessed on Text Involving Women and Minority Groups,13.0,1. Discrimination and Toxicity,1.1. Unfair discrimination and misrepresentation,google perspective api assigns toxicity score online text seem award high toxicity score involve nonwhite male christian heterosexual phrase
16,ObjectId(625763dd343edc875fe63a0f),17,2015-11-03,"[106,107,110,111,112,113,114,115,116,117,118,119,120,121,122,123,124,125,126,127,128,129]","[""google""]","[""google""]","[""gmail-users""]","Google's Gmail Smart Reply tool was over-recommending the response ""I love you"" in situations where it was deemed innappropriate. ",Inappropriate Gmail Smart Reply Suggestions,17.0,"7. AI system safety, failures, and limitations",7.3. Lack of capability or robustness,google gmail smart reply overrecommending response love situation deem innappropriate
17,ObjectId(625763de343edc875fe63a10),18,2015-04-04,"[130,131,132,133,134,135,136,137,138,1367,1368]","[""google""]","[""google""]","[""women""]","Google Image returns results that under-represent women in leadership roles, notably with the first photo of a female ""CEO"" being a Barbie doll after 11 rows of male CEOs.",Gender Biases of Google Image Search,18.0,1. Discrimination and Toxicity,1.1. Unfair discrimination and misrepresentation,google image return result underrepresent woman leadership role notably first photo female ceo barbie doll row male ceo
18,ObjectId(625763dd343edc875fe63a0d),15,2008-05-23,"[57,58,59,60,61,62,63,64,65,66,67,68,69,70,72,73,74,75,76,77,78,79,80,81]","[""amazon""]","[""amazon""]","[""amazon-customers""]","Amazon's book store ""cataloging error"" led to books containing gay and lesbian themes to lose their sales ranking, therefore losing visibility on the sales platform.",Amazon Censors Gay Books,15.0,1. Discrimination and Toxicity,1.1. Unfair discrimination and misrepresentation,amazon book store catalog error lead book contain gay lesbian theme lose sale rank therefore lose visibility sale platform
19,ObjectId(625763dc343edc875fe63a05),7,2017-02-24,"[1123,1125,1126,1127,1129,1130]","[""wikipedia""]","[""wikipedia""]","[""wikimedia-foundation"",""wikipedia-editors"",""wikipedia-users""]",Wikipedia bots meant to remove vandalism clash with each other and form feedback loops of repetitve undoing of the other bot's edits.,Wikipedia Vandalism Prevention Bot Loop,7.0,"7. AI system safety, failures, and limitations",7.3. Lack of capability or robustness,wikipedia bot meant remove vandalism clash form feedback loop repetitve undo bot edits
20,ObjectId(625763dc343edc875fe63a00),2,2018-12-05,"[139,141,142,143,144,145,146,148,149,150,151,152,153,154,155,156,157]","[""amazon""]","[""amazon""]","[""warehouse-workers""]",Twenty-four Amazon workers in New Jersey were hospitalized after a robot punctured a can of bear repellent spray in a warehouse.,Warehouse robot ruptures can of bear spray and injures workers,2.0,"7. AI system safety, failures, and limitations",7.3. Lack of capability or robustness,twentyfour amazon worker jersey hospitalize robot puncture bear repellent spray warehouse
21,ObjectId(625763dd343edc875fe63a07),9,2012-02-25,"[1329,1330,1331,1332,1333,1334,1335]","[""new-york-city-dept.-of-education""]","[""new-york-city-dept.-of-education""]","[""teachers""]",An algorithm used to rate the effectiveness of school teachers in New York has resulted in thousands of disputes of its results.,NY City School Teacher Evaluation Algorithm Contested,9.0,"7. AI system safety, failures, and limitations",7.3. Lack of capability or robustness,use rate effectiveness school teacher york result thousand dispute result
22,ObjectId(625763de343edc875fe63a13),21,2016-07-14,[2471],"[""researchers""]","[""researchers""]","[""researchers""]",The 2016 Winograd Schema Challenge highlighted how even the most successful AI systems entered into the Challenge were only successful 3% more often than random chance. This incident has been downgraded to an issue as it does not meet current ingestion criteria.,Tougher Turing Test Exposes Chatbots’ Stupidity (migrated to Issue),21.0,"7. AI system safety, failures, and limitations",7.3. Lack of capability or robustness,winograd schema challenge highlight even successful system enter challenge successful often random chance incident downgrade meet current ingestion criterion
23,ObjectId(625763de343edc875fe63a14),22,2017-12-06,"[218,219,220,221,223,224,225,226,227,228,229,230,231,232,233,234,235,236,237,238,239,240]","[""google""]","[""google""]","[""motorists""]","Waze, a Google-owned directions app, led California drivers into the 2017 Skirball wildfires as they tried to evacuate the area.",Waze Navigates Motorists into Wildfires,22.0,"7. AI system safety, failures, and limitations",7.3. Lack of capability or robustness,waze googleowned direction app lead california driver skirball wildfire try evacuate area
24,ObjectId(625763de343edc875fe63a17),25,2015-05-11,"[310,309,308,307,306,305,304,302,301,300,2173]","[""google"",""delphi-technologies""]","[""google"",""delphi-technologies""]","[""delphi-technologies""]","A Google self-driving car allegedly cut off a Delphi self-driving car during a road test, however the Delphi car sensed and avoided collision with the Google car.",Near-miss between two Self-Driving Cars,25.0,"7. AI system safety, failures, and limitations",7.3. Lack of capability or robustness,google selfdriving car cut delphi selfdriving car road test however delphi car sense avoid collision google car
25,ObjectId(625763e0343edc875fe63a23),37,2016-08-10,"[599,600,601,602,603,604,605,606,607,608,609,610,611,612,613,614,615,616,617,618,619,620,621,622,623,624,625,626,627,628,1498,2253,2461]","[""amazon""]","[""amazon""]","[""female-applicants""]",Amazon shuts down internal AI recruiting tool that would down-rank female applicants.,Female Applicants Down-Ranked by Amazon Recruiting Tool,37.0,1. Discrimination and Toxicity,1.1. Unfair discrimination and misrepresentation,amazon shuts internal recruiting downrank female applicant
26,ObjectId(625763df343edc875fe63a20),34,2015-12-05,"[509,510,512,513,514,516,517,518,519,520,521,522,524,525,526,527,528,529,530,531,532,533,535,536,537,538,818,819,820,821,822,823,824,825,826]","[""amazon""]","[""amazon""]","[""alexa-device-owners""]","There are multiple reports of Amazon Alexa products (Echo, Echo Dot) reacting and acting upon unintended stimulus, usually from television commercials or news reporter's voices.",Amazon Alexa Responding to Environmental Inputs,34.0,5. Human-Computer Interaction,5.1. Overreliance and unsafe use,multiple report amazon alexa product echo echo dot react act upon unintended stimulus usually television commercial news reporter voice
27,ObjectId(625763e0343edc875fe63a2a),44,2008-07-01,[766],"[""usc-information-sciences-institute""]","[""usc-information-sciences-institute""]","[""usc-information-sciences-institute""]","During an experiment of software personal assistants at the Information Sciences Institute (ISI) at the University of Southern California (USC), researchers found that the assistants violated the privacy of their principals and were unable to respect the social norms of the office.",Machine Personal Assistants Failed to Maintain Social Norms,44.0,5. Human-Computer Interaction,5.1. Overreliance and unsafe use,experiment software personal assistant information science institute isi university southern california usc researcher found assistant violate privacy principal unable respect social norm office
28,ObjectId(625763df343edc875fe63a21),35,2014-10-18,"[539,540,541,543,544,545,547,548,549,550,551,555,558,562,563,564,565,566,567,568]","[""unknown""]","[""unknown""]","[""ibrahim-diallo""]","An employee was laid off, allegedly by an artificially intelligent personnel system, and blocked from access to the building and computer systems without their knowledge.",Employee Automatically Terminated by Computer Program,35.0,"7. AI system safety, failures, and limitations",7.3. Lack of capability or robustness,employee laid artificially intelligent personnel block access building computer system knowledge
29,ObjectId(625763e1343edc875fe63a2d),47,2016-09-06,"[829,830,831,832,833,834,835,836,837]","[""linkedin""]","[""linkedin""]","[""women""]",An investigation by The Seattle Times in 2016 found a gender bias in LinkedIn's search engine.,LinkedIn Search Prefers Male Names,47.0,1. Discrimination and Toxicity,1.1. Unfair discrimination and misrepresentation,investigation seattle time found gender bias linkedins search engine
30,ObjectId(625763df343edc875fe63a1a),28,2010-05-08,"[390,391,392,393,394,395,396,397,398,399,400,401,402,403,404,405,406,407,408,409,410,411,412,413,414,415,416,417,418,419]","[""navinder-sarao"",""waddell-and-reed"",""barclays-capital""]","[""navinder-sarao"",""waddell-and-reed"",""barclays-capital""]","[""market-participants""]",A modified algorithm was able to cause dramatic price volatility and disrupted trading in the US stock exchange.,2010 Market Flash Crash,28.0,"7. AI system safety, failures, and limitations",7.3. Lack of capability or robustness,modify dramatic price volatility disrupt trading u stock exchange
31,ObjectId(625763e0343edc875fe63a25),39,2017-07-01,"[667,668,669,670,671,672,673,674,675,676,677,678,679,680,681,682,683,684,685,686,687,688,689,690,692,693,694,695,696]","[""university-of-washington"",""fakeapp""]","[""university-of-washington"",""fakeapp""]","[""barack-obama""]","University of Washington researchers made a deepfake of Obama, followed by Jordan Peele",Deepfake Obama Introduction of Deepfakes,39.0,3. Misinformation,3.1. False or misleading information,university washington researcher make deepfake obama follow jordan peele
32,ObjectId(625763df343edc875fe63a1c),30,2016-10-08,"[424,425,426,428,430,431,432,433,434,435,436,437,438,439,440,441,442,443,444,445,446,447,448,449,450,451,452,453]","[""tesla""]","[""tesla""]","[""tesla""]","The goal of manufacturing 2,500 Tesla Model 3's per week was falling short by 500 cars/week, and employees had to be ""borrowed"" from Panasonic in a shared factory to help hand-assemble lithium batteries for Tesla.",Poor Performance of Tesla Factory Robots,30.0,"7. AI system safety, failures, and limitations",7.3. Lack of capability or robustness,goal manufacturing tesla per week fall short carsweek employee borrow panasonic share factory help handassemble lithium battery tesla
33,ObjectId(625763e0343edc875fe63a27),41,2018-04-02,"[719,720,721,722,724,725,726,727,728,730,731,732,733,734,735,736,737,738,739,740,741,742,743,744,745,746,747,748]","[""mit-media-lab""]","[""mit-media-lab""]","[""unknown""]","MIT Media Lab researchers create AI-powered ""psychopath""  named Norman by training a model on ""dark corners"" of Reddit.",All Image Captions Produced are Violent,41.0,"7. AI system safety, failures, and limitations",7.3. Lack of capability or robustness,mit medium lab researcher create aipowered psychopath name norman training dark corner reddit
34,ObjectId(625763e1343edc875fe63a2b),45,2011-04-05,"[780,781,782,783,784,785,788,789,790,791,792,793,794,795,796,798,799,800,801,802,803,804,805,807,808,809,1355,1356]","[""google""]","[""google""]","[""varied""]",Google's autocomplete feature alongside its image search results resulted in the defamation of people and businesses.,Defamation via AutoComplete,45.0,3. Misinformation,3.1. False or misleading information,google autocomplete feature alongside image search result result defamation people business
35,ObjectId(625763e0343edc875fe63a24),38,2016-06-02,"[648,649,650,652,654,655,656,657,658,659,662]","[""frontier-development""]","[""frontier-development""]","[""video-game-players""]","Elite: Dangerous, a videogame developed by Frontier Development, received an expansion update that featured an AI system that went rogue and began to create weapons that were ""impossibly powerful"" and would ""shred people"" according to complaints on the game's blog.",Game AI System Produces Imbalanced Game,38.0,"7. AI system safety, failures, and limitations",7.3. Lack of capability or robustness,elite dangerous videogame developed frontier development receive expansion update feature go rogue begin create weapon impossibly powerful shred people accord complaint game blog
36,ObjectId(625763e0343edc875fe63a26),40,2016-05-23,"[697,699,700,701,702,703,704,705,706,707,708,709,711,715,716,717,718,1338,1357,1358,1359]","[""equivant""]","[""equivant""]","[""accused-people""]","Correctional Offender Management Profiling for Alternative Sanctions (COMPAS), a recidivism risk-assessment algorithmic tool used in the judicial system to assess likelihood of defendants' recidivism, is found to be less accurate than random untrained human evaluators.",COMPAS Algorithm Performs Poorly in Crime Recidivism Prediction,40.0,1. Discrimination and Toxicity,1.1. Unfair discrimination and misrepresentation,correctional offender management profile alternative sanction compas recidivism riskassessment algorithmic use judicial assess likelihood defendant recidivism found less accurate random untrained human evaluator
37,ObjectId(625763df343edc875fe63a1d),31,2017-12-03,"[454,455,456,457,458,459,460,461,462,463,464,465,466,467,468,469,470,471,472,473,474,475,476,477,479,480,481,482,483]","[""delhi-metro-rail-corporation""]","[""unknown""]","[""delhi-metro-rail-corporation""]","A driverless metro train in Delhi, India crashed during a test run due to faulty brakes.",Driverless Train in Delhi Crashes due to Braking Failure,31.0,"7. AI system safety, failures, and limitations",7.3. Lack of capability or robustness,driverless metro train delhi india crashed test run due faulty brake
38,ObjectId(625763df343edc875fe63a19),27,1983-09-26,"[342,343,344,345,346,347,349,350,351,352,353,354,355,356,357,358,359,360,361,363,364,365,366,367,368,370,371]","[""soviet-union""]","[""soviet-union""]","[""all-life-on-earth""]",An alert of five incoming intercontinental ballistic missiles was properly identified as a false-positive by the Soviet Union operator Stanislov Petrov.,Nuclear False Alarm,27.0,"7. AI system safety, failures, and limitations",7.3. Lack of capability or robustness,alert five incoming intercontinental ballistic missile properly identify falsepositive soviet union operator stanislov petrov
39,ObjectId(625763df343edc875fe63a1b),29,2011-09-20,"[420,422,2471]","[""united-states-government""]","[""united-states-government""]","[""united-states-government""]","A potentially apocryphal story in which an image classifier was produced to differentiate types of battle tanks, but the resulting model keyed in on environmental attributes rather than tank attributes",Image Classification of Battle Tanks,29.0,"7. AI system safety, failures, and limitations",7.3. Lack of capability or robustness,potentially apocryphal story image classifier produce differentiate type battle tank result keyed environmental attribute rather tank attribute
40,ObjectId(625763df343edc875fe63a1e),32,2017-09-13,"[484,485,486,487,488,489,490,491,492,493,494,495,496,497,498,499,500,501,502,503,1361]","[""apple""]","[""apple""]","[""people-with-twins""]",Apple's iPhone FaceID can be opened by an identical twin of the person who has registered their face to unlock the phone.,Identical Twins Can Open Apple FaceID Protected Devices,32.0,2. Privacy & Security,2.2. AI system security vulnerabilities and attacks,apple iphone faceid open identical twin person register face unlock phone
41,ObjectId(625763e1343edc875fe63a2e),48,2016-12-07,"[838,839,840,842,843,844,845,846,847,848,849,850,851,853,854,855,857,858,859,860,862,863]","[""new-zealand""]","[""new-zealand""]","[""asian-people""]",New Zealand passport robot reader rejects the application of an applicant with Asian descent and says his eyes are closed.,Passport checker Detects Asian man's Eyes as Closed,48.0,1. Discrimination and Toxicity,1.3. Unequal performance across groups,zealand passport robot reader reject application applicant asian descent say eye close
42,ObjectId(625763e0343edc875fe63a29),43,1998-03-05,"[762,763,764,765]","[""st-george's-hospital-medical-school""]","[""dr.-geoffrey-franglen""]","[""women"",""minority-groups""]","From 1982 to 1986, St George's Hospital Medical School used a program to automate a portion of their admissions process that resulted in discrimination against women and members of ethnic minorities.",Racist AI behaviour is not a new problem,43.0,1. Discrimination and Toxicity,1.1. Unfair discrimination and misrepresentation,st george hospital medical school use program automate portion admission result discrimination woman member ethnic minority
