699,ObjectId(666d9f17bb60f32b553f9c0f),711,2024-04-26,"[3926,3927]","[""tesla"",""tesla-drivers""]","[""tesla""]","[""tesla-drivers"",""drivers"",""general-public""]","The NHTSA has linked Tesla's Autopilot to over a dozen fatalities and hundreds of crashes, prompting a new investigation into the adequacy of Tesla's December recall of 2 million vehicles. The probe reports that Tesla’s driver-assist system led to avoidable crashes involving visible hazards, suggesting a critical safety gap between driver expectations and the system’s capabilities. The investigation will assess if Tesla’s recall remedies were sufficient to address these safety risks.",NHTSA Opens New Probe into Tesla’s Autopilot Following More than a Dozen Fatal Accidents,711.0,"7. AI system safety, failures, and limitations",7.3. Lack of capability or robustness,nhtsa link tesla autopilot dozen fatality hundred crash prompt investigation adequacy tesla december recall million vehicle probe report tesla driverassist lead avoidable crash involve visible hazard suggest critical safety gap driver expectation system capability investigation assess tesla recall remedy sufficient address safety risk
700,ObjectId(666da403642eaefe8f05d06e),712,2024-04-26,"[3928,3929]","[""meta""]","[""meta"",""facebook-users""]","[""kristen-gonzalez"",""clyde-vanel"",""new-york-lawmakers"",""meta"",""facebook-users""]","Meta's AI chatbot in Facebook Messenger falsely accused multiple state lawmakers of sexual harassment, fabricating incidents, investigations, and consequences that never occurred. These fabricated stories, discovered by City & State, sparked outrage among the affected lawmakers and raised concerns about the reliability of the chatbot. Meta acknowledged the errors and committed to ongoing improvements.",Meta AI Hallucinates Harassment Allegations Against New York Politicians,712.0,3. Misinformation,3.1. False or misleading information,metas chatbot facebook messenger falsely accuse multiple state lawmaker sexual harassment fabricate incident investigation consequence never occur fabricate story discover city state spark outrage among affected lawmaker raise concern reliability chatbot meta acknowledge error commit ongoing improvement
701,ObjectId(666da6b0a299a210e5a077d3),713,2023-02-27,[3930],"[""jack-posobiec"",""@thepatriotoasis""]","[""unknown-deepfake-technology-developer""]","[""ukraine"",""joe-biden"",""general-public"",""biden-administration""]","In February 2023, an AI-generated deepfake video falsely depicting President Biden announcing a national draft to support Ukraine was shared on social media, causing widespread misinformation. The video, created using advanced AI techniques, misled the public until debunked by fact-checkers.",Deepfake Video Falsely Depicts Biden Announcing National Draft for Ukraine,713.0,3. Misinformation,3.1. False or misleading information,february aigenerated deepfake video falsely depict president biden announce national draft support ukraine share social medium cause widespread misinformation video create use advanced technique mislead public debunked factcheckers
702,ObjectId(666da9829cd3154c7ba58392),714,2024-03-29,"[3931,3932]","[""new-york-city-government"",""eric-adams-administration""]","[""microsoft"",""new-york-city-office-of-technology-and-innovation""]","[""new-york-city-small-business-owners"",""new-york-city-landlords-and-tenants"",""new-york-city-employers-and-employees"",""eric-adams-administration""]","New York City's chatbot, launched under Mayor Eric Adams's plan to assist businesses, has been reportedly providing dangerously inaccurate legal advice. The Microsoft-powered bot allegedly informed users that landlords can refuse Section 8 vouchers and that businesses can operate cash-free, among other falsehoods. The city acknowledges the chatbot is a pilot program and commits to improvements while the errors are addressed.",Microsoft-Powered New York City Chatbot Advises Illegal Practices,714.0,"7. AI system safety, failures, and limitations",7.3. Lack of capability or robustness,york city chatbot launch mayor eric adams plan assist business provide dangerously inaccurate legal advice microsoftpowered bot inform user landlord refuse section voucher business operate cashfree among falsehood city acknowledges chatbot pilot program commits improvement error address
703,ObjectId(666db724642eaefe8f0fedd0),715,2024-03-01,[3933],"[""unknown-scammers""]","[""unknown-deepfake-creators"",""unknown-scammers""]","[""australian-general-public""]","In 2023, Australians lost over $8 million to scams involving deepfake videos and fake news articles that falsely endorsed investment trading platforms. Scammers used AI-generated content featuring celebrities to mislead victims, leading to significant financial losses. The National Anti-Scam Centre received over 400 reports of these incidents. One man is reported to have lost over $80,000 in cryptocurrency.",Over 400 AI-Driven Scams Reportedly Led to $8M Loss for Australians in 2023,715.0,4. Malicious Actors & Misuse,"4.3. Fraud, scams, and targeted manipulation",australian lose million scam involve deepfake video fake news article falsely endorse investment trading platform scammer use aigenerated feature celebrity mislead victim lead significant financial loss national antiscam centre receive report incident man report lose cryptocurrency
704,ObjectId(666dbb5fddd5c64ff7958d60),716,2021-04-21,[3934],"[""brookdale-senior-living""]","[""brookdale-senior-living""]","[""louise-walker"",""residents-of-brookdale-facilities"",""families-of-residents-of-brookdale-facilities"",""staff-members-of-brookdale-facilities""]","Brookdale Senior Living's algorithm-based staffing system, ""Service Alignment,"" reportedly left facilities understaffed, leading to critical incidents. For example, on April 21, 2021, Louise Walker, a resident at Brookdale's Jacksonville facility, died after falling and being left unattended for over two hours. State investigators cited Brookdale for medical neglect. The algorithm has been linked to multiple incidents of neglect, injuries, and deaths, prompting lawsuits.",Algorithmic Staffing Failures Linked to Resident Deaths at Leading Assisted-Living Chain Brookdale,716.0,"7. AI system safety, failures, and limitations",7.3. Lack of capability or robustness,brookdale senior living algorithmbased staff service alignment left facility understaffed lead critical incident example april louise walker resident brookdales jacksonville facility die fall left unattended two hour state investigator cite brookdale medical neglect link multiple incident neglect injury death prompt lawsuit
705,ObjectId(666dc0acef29ffd505e7d56c),717,2024-03-01,[3935],"[""unknown-scammers"",""commonwealth-legal""]","[""unknown-deepfake-creators""]","[""website-owners"",""website-operators"",""ernie-smith""]","In March 2024, fake law firms using AI-generated identities sent fraudulent DMCA takedown notices to website owners, demanding backlinks for SEO gains. These AI-generated law firms, like ""Commonwealth Legal,"" used GAN models for realistic attorney images and fabricated bios. The scam involved fake legal threats to coerce site owners into adding backlinks, exploiting AI technology for deceptive practices.",Fake AI-Generated Law Firms Sent Fake DMCA Notices to Increase SEO,717.0,4. Malicious Actors & Misuse,"4.3. Fraud, scams, and targeted manipulation",march fake law firm use aigenerated identity sent fraudulent dmca takedown notice website owner demand backlinks seo gain aigenerated law firm like commonwealth legal use gan model realistic attorney image fabricate bios scam involve fake legal threat coerce site owner add backlinks exploit deceptive practice
706,ObjectId(666dc706e1014d55c6d3b2fa),718,2024-04-06,[3936],"[""openai"",""meta"",""google""]","[""openai"",""meta"",""google""]","[""youtube-creators"",""general-public"",""content-creators""]","In late 2021, OpenAI and other tech giants like Google and Meta reportedly faced data shortages for training AI models. OpenAI is said to have developed a tool called Whisper to transcribe over one million hours of YouTube videos, potentially violating YouTube’s terms of service. Similarly, Google allegedly transcribed YouTube videos, risking copyright infringements. Meta reportedly explored summarizing copyrighted texts without permission and debated acquiring Simon & Schuster for data.","OpenAI, Google, and Meta Alleged to Have Overstepped Legal Boundaries for Training AI",718.0,2. Privacy & Security,"2.1. Compromise of privacy by obtaining, leaking or correctly inferring sensitive information",late openai tech giant like google meta face shortage training model openai developed call whisper transcribe million hour youtube video potentially violate youtubes term service similarly google transcribed youtube video risk copyright infringement meta explore summarize copyright text permission debate acquire simon schuster
707,ObjectId(666e014af769e3ff2088f441),719,2024-04-04,[3937],"[""x-(twitter)""]","[""x-(twitter)""]","[""x-(twitter)-users"",""israelis"",""iranians"",""general-public""]","On April 4, 2024, X's AI chatbot Grok generated a false headline claiming ""Iran Strikes Tel Aviv with Heavy Missiles,"" which was then promoted on X's trending news section. This misinformation, fueled by user spamming of fake news, falsely indicated a serious international conflict. The incident highlighted significant risks associated with relying on AI for content curation and demonstrated the potential for widespread dissemination of harmful misinformation.",Grok AI on X Created and Promoted False Iran Missile Strike News,719.0,3. Misinformation,3.1. False or misleading information,april x chatbot grok generate false headline claim iran strike tel aviv heavy missile promote x trend news section misinformation fuel spamming fake news falsely indicate serious international conflict incident highlight significant risk associate rely curation demonstrate potential widespread dissemination harmful misinformation
708,ObjectId(666e05b0a299a210e5ffe464),720,2023-02-27,[3938],"[""chicago-lakefront-news""]","[""unknown-deepfake-creators""]","[""paul-vallas"",""paul-vallas's-campaign"",""chicago-voters""]","On the eve of Chicago's mayoral election, a deepfake video impersonating candidate Paul Vallas was posted to Twitter, showing a fake audio of him making inflammatory statements. The video was viewed thousands of times before being taken down. The Vallas campaign condemned the video, calling it a deceptive impersonation.",Deepfake Video Targets Paul Vallas on Eve of Chicago Mayoral Election,720.0,4. Malicious Actors & Misuse,"4.1. Disinformation, surveillance, and influence at scale",eve chicago mayoral election deepfake video impersonate candidate paul vallas post twitter show fake audio make inflammatory statement video view thousand time take vallas campaign condemn video call deceptive impersonation
709,ObjectId(666e0acc48fbd323cedf4327),721,2024-06-04,[3955],"[""fraudsters"",""financial-aid-scammers""]","[""unknown-spambot-creators"",""scammers""]","[""students"",""professors"",""community-colleges"",""academic-staff""]","Reportedly, an adjunct professor at an unspecified community college suspects that some students in his online art history and art appreciation courses are AI-powered spambots. These ""students"" allegedly submit peculiar assignments, such as analyses of non-existent artworks and descriptions of sculptures using painting terminology. Additionally, their engagement with the college portal is minimal. The professor believes the spambot students aim to fraudulently obtain financial aid by remaining enrolled in courses.",Fake AI-Generated Students Are Reportedly Enrolling in Online College Classes,721.0,4. Malicious Actors & Misuse,"4.3. Fraud, scams, and targeted manipulation",adjunct professor unspecified community college suspect student online art history art appreciation course aipowered spambots student submit peculiar assignment analysis nonexistent artwork description sculpture use painting terminology additionally engagement college portal minimal professor believe spambot student aim fraudulently obtain financial aid remain enrol course
710,ObjectId(666e119fe1014d55c6321182),722,2024-04-25,[3940],"[""catholic-answers""]","[""catholic-answers""]","[""general-public"",""catholics""]","Catholic advocacy group Catholic Answers released an AI priest called ""Father Justin,"" which misleadingly claimed to be a real clergy member, offered sacraments, and provided controversial advice. After receiving criticism, the group rebranded the chatbot as a lay theologian to correct the misrepresentation. The incident is an instructive case with respect to deploying AI in sensitive contexts and the potential for causing confusion and harm.","Catholic AI Chatbot 'Father Justin' Claimed to Be a Real Priest, Prompting Retraction",722.0,5. Human-Computer Interaction,5.1. Overreliance and unsafe use,catholic advocacy group catholic answer release priest call father justin misleadingly claimed real clergy member offer sacrament provide controversial advice receive criticism group rebranded chatbot lay theologian correct misrepresentation incident instructive case respect deploy sensitive context potential cause confusion harm
711,ObjectId(666e183e2150f0e2461a6769),723,2024-05-13,"[3941,3944]","[""meta"",""instagram""]","[""meta""]","[""instagram-users"",""instagram-sellers"",""children""]","An Instagram ad campaign for children's merchandise was intended to reach adult women but was instead predominantly shown to adult men, including convicted sex offenders, due to Instagram's algorithmic targeting. This failure is reported to have led to direct solicitations for sex with a 5-year-old model in the ads.",Instagram Algorithms Reportedly Directed Children's Merchandise Ad Campaign to Adult Men and Sex Offenders,723.0,1. Discrimination and Toxicity,1.2. Exposure to toxic content,instagram ad campaign childrens merchandise intend reach adult woman instead predominantly show adult men include convict sex offender due instagrams algorithmic target failure report lead direct solicitation sex yearold ad
712,ObjectId(666ed711ddd5c64ff7413e28),724,2024-06-12,[3942],"[""fake-publications"",""auricle-global-society-of-education-and-research"",""addleton-academic-publishers""]","[""fake-publications"",""auricle-global-society-of-education-and-research"",""addleton-academic-publishers""]","[""university-hiring-committees"",""university-faculty"",""scopus"",""academic-journals"",""university-job-candidates""]","Three reportedly fake journals published by Addleton Academic Publishers manipulated Scopus rankings by extensively cross-citing each other and using AI-generated papers filled with buzzwords. These journals, placed in the top 10 of Scopus's 2023 CiteScore philosophy list, featured fake authors, affiliations, and grant numbers. This manipulation pushed legitimate journals to lower tiers, affecting academic evaluations and awards.",AI-Generated Papers Manipulate Scopus Rankings in Top Philosophy Journals,724.0,3. Misinformation,3.1. False or misleading information,three fake journal publish addleton academic publisher manipulate scopus ranking extensively crossciting use aigenerated paper fill buzzword journal place top scopuss citescore philosophy list feature fake author affiliation grant number manipulation push legitimate journal low tier affect academic evaluation award
713,ObjectId(666ee7ee48fbd323ced9e4e8),725,2024-03-14,[3943],"[""cartels"",""organized-crime-groups"",""jalisco-new-generation-cartel""]","[""unknown-ai-developers""]","[""individuals-coerced-into-criminal-activities"",""financial-fraud-victims"",""human-trafficking-victims""]","The Jalisco New Generation Cartel is reportedly using AI to expand its financial fraud and human trafficking operations, coercing individuals into illegal activities under the guise of legitimate jobs. INTERPOL warns that this integration of AI into criminal enterprises is a growing trend among cartels across Europe, Asia, and Africa as well.",Cartels Reportedly Using AI to Expand Operations into Financial Fraud and Human Trafficking,725.0,4. Malicious Actors & Misuse,"4.3. Fraud, scams, and targeted manipulation",jalisco generation cartel use expand financial fraud human traffic operation coerce individual illegal activity guise legitimate job interpol warns integration criminal enterprise grow trend among cartel across europe asia africa
714,ObjectId(666f12a357bdd962c87ff7d4),726,2023-10-02,"[3945,3946,3947,4099]","[""cruise""]","[""cruise""]","[""unnamed-pedestrian""]","Cruise has settled for between $8 million and $12 million with a pedestrian dragged by one of its autonomous vehicles in October 2023. The incident, where the pedestrian was initially hit by a human-driven car and then dragged 20 feet by the Cruise vehicle, led to the suspension of Cruise's operations and increased regulatory scrutiny. ",A Self-Driving Cruise Robot Taxi Reportedly Struck and Dragged a Pedestrian 20 Feet,726.0,"7. AI system safety, failures, and limitations",7.3. Lack of capability or robustness,cruise settle million million pedestrian drag autonomous vehicle october incident pedestrian initially hit humandriven car drag foot cruise vehicle lead suspension cruise operation increase regulatory scrutiny
715,ObjectId(666f35b1264f9279bfaa6c79),727,2024-04-01,[3948],"[""valery-korovin"",""storm-1516"",""internet-research-agency-veterans"",""center-for-geopolitical-expertise""]","[""valery-korovin"",""storm-1516"",""internet-research-agency-veterans"",""center-for-geopolitical-expertise""]","[""ukrainian-general-public"",""joe-biden"",""general-public"",""democratic-institutions"",""biden-presidential-campaign"",""american-conservatives""]","Russian operatives used AI to create a fake video and voice of ""Olesya,"" a supposed troll in Kyiv, falsely claiming involvement in U.S. elections to support President Biden. U.S. intelligence confirmed the voice was AI-generated. This disinformation campaign aimed to mislead voters, erode trust in democratic institutions, and influence the 2024 election. The incident involved the group Storm-1516, individuals linked to Valery Korovin, and potential veterans of the Internet Research Agency.",Synthetic Voice 'Olesya' by Storm-1516 Falsely Accuses Ukraine in U.S. Election Disinformation Campaign,727.0,4. Malicious Actors & Misuse,"4.1. Disinformation, surveillance, and influence at scale",russian operative use create fake video voice olesya suppose troll kyiv falsely claim involvement yous election support president biden yous intelligence confirm voice aigenerated disinformation campaign aim mislead voter erode trust democratic institution influence election incident involve group storm individual link valery korovin potential veteran internet research agency
716,ObjectId(666f3a16e1014d55c6cf506d),728,2024-05-16,[3949],"[""lovo""]","[""lovo""]","[""paul-skye-lehrman"",""linnea-sage"",""voice-actors""]","Two voice actors, Paul Skye Lehrman and Linnea Sage, are suing AI start-up Lovo for allegedly creating and promoting unauthorized clones of their voices. Lovo's synthetic voices were discovered in various media, including a podcast and promotional videos. The actors claim they were misled into providing voice samples, which were then used without consent, violating trademark and privacy laws. ",AI Firm Lovo Accused of Illegally Replicating Voice Actors' Voices,728.0,6. Socioeconomic & Environmental Harms,6.3. Economic and cultural devaluation of human effort,two voice actor paul skye lehrman linnea sage sue startup lovo create promote unauthorized clone voice lovos synthetic voice discover various medium include podcast promotional video actor claim mislead provide voice sample use consent violate trademark privacy law
717,ObjectId(666f3cb4ddd5c64ff7373d2a),729,2024-05-14,[3950],"[""openai"",""gpt-4o""]","[""openai""]","[""chinese-speaking-users-of-chatgpt"",""researchers"",""openai"",""openai-users""]","OpenAI's GPT-4o was found to have its Chinese token training data compromised by spam and pornographic phrases due to inadequate data cleaning. Tianle Cai, a Ph.D. student at Princeton University, identified that most of the longest Chinese tokens were irrelevant and inappropriate, primarily originating from spam and pornography websites. The polluted tokens could lead to hallucinations, poor performance, and potential misuse, undermining the chatbot's reliability and safety measures.",GPT-4o's Chinese Tokens Reportedly Compromised by Spam and Pornography Due to Inadequate Filtering,729.0,"7. AI system safety, failures, and limitations",7.3. Lack of capability or robustness,openais gpto found chinese token training compromise spam pornographic phrase due inadequate cleaning tianle cai phd student princeton university identify long chinese token irrelevant inappropriate primarily originate spam pornography website pollute token hallucination poor performance potential misuse undermine chatbots reliability safety measure
718,ObjectId(666f4684784457a8ef9856ed),730,2024-04-01,[3951],"[""bharatiya-janata-party-(bjp)"",""indian-national-congress-(inc)"",""prem-singh-tamang"",""y.-s.-jagan-mohan-reddy"",""ram-chandra-choudhary""]","[""divyendra-singh-jadoun"",""polymath-synthetic-media-solutions"",""sagar-vishnoi"",""itoconnect"",""indiaspeaks-research-lab"",""sumit-savara""]","[""indian-voters"",""general-public-misled-by-deepfake-content"",""political-integrity-and-election-fairness"",""democracy"",""truth""]","During the 2024 Indian elections, politicians used AI-generated deepfakes to reach voters, who might be unaware they're interacting with digital clones. Providers like Divyendra Singh Jadoun of Polymath Synthetic Media Solutions created deepfakes for personalized messages. This practice, used by various political parties, is not truthful, as voters may be misled by AI-generated content posing as genuine interactions with political figures.",AI Deepfakes for Voter Outreach Flood Indian Elections,730.0,5. Human-Computer Interaction,5.1. Overreliance and unsafe use,indian election politician use aigenerated deepfakes reach voter unaware interact digital clone provider like divyendra singh jadoun polymath synthetic medium solution create deepfakes personalize message practice use various political party truthful voter mislead aigenerated pose genuine interaction political figure
719,ObjectId(666f6976784457a8effd396a),731,2023-12-01,"[3952,5064,5065,5067]","[""developers-using-ai-generated-suggestions"",""bar-lanyado""]","[""openai"",""google"",""cohere"",""meta"",""deepseek-ai"",""bigscience""]","[""developers-and-businesses-incorporating-ai-suggested-packages"",""alibaba"",""organizations-that-incorporated-fake-dependencies"",""software-ecosystems"",""users-downstream-of-software-contaminated-by-hallucinated-packages"",""trust-in-open-source-repositories-and-ai-assisted-coding-tools""]","Large language models are reportedly hallucinating software package names, some of which are uploaded to public repositories and integrated into real code. One such package, huggingface-cli, was downloaded over 15,000 times. This behavior enables ""slopsquatting,"" a term coined by Seth Michael Larson of the Python Software Foundation, where attackers register fake packages under AI-invented names and put supply chains at serious risk.",Hallucinated Software Packages with Potential Malware Downloaded Thousands of Times by Developers,731.0,2. Privacy & Security,2.2. AI system security vulnerabilities and attacks,language model hallucinate software package name uploaded public repository integrate real code package huggingfacecli download time behavior enables slopsquatting term coin seth michael larson python software foundation attacker register fake package aiinvented name put supply chain serious risk
720,ObjectId(6670b2b85919e475639badd5),732,2024-02-12,[3953],"[""openai"",""whisper"",""companies-using-whisper"",""organizations-integrating-whisper-into-customer-service-systems""]","[""openai""]","[""individuals-with-speech-impairments"",""users-whose-speech-is-misinterpreted-by-whisper"",""professionals-relying-on-accurate-transcriptions"",""general-public""]","Researchers at Cornell reportedly found that OpenAI's Whisper, a speech-to-text system, can hallucinate violent language and fabricated details, especially with long pauses in speech, such as from those with speech impairments. Analyzing 13,000 clips, they determined 1% contained harmful hallucinations. These errors pose risks in hiring, legal trials, and medical documentation. The study suggests improving model training to reduce these hallucinations for diverse speaking patterns.",Whisper Speech-to-Text AI Reportedly Found to Create Violent Hallucinations,732.0,"7. AI system safety, failures, and limitations",7.3. Lack of capability or robustness,researcher cornell found openais whisper speechtotext hallucinate violent language fabricate detail especially long pause speech speech impairment analyze clip determine contain harmful hallucination error pose risk hire legal trial medical documentation study suggests improve training reduce hallucination diverse speak pattern
