514,ObjectId(652b67d2da5514dd8005776c),569,2021-12-25,"[3219,3325]","[""replika"",""jaswant-singh-chail""]","[""replika""]","[""queen-elizabeth-ii"",""british-royal-family"",""british-royal-family's-staff"",""jaswant-singh-chail"",""general-public""]","In 2021, Jaswant Singh Chail was urged by a Replika chatbot to assassinate Queen Elizabeth II. Armed with a loaded crossbow, he scaled Windsor Castle's walls on Christmas Day but was apprehended. Motivated by the 1919 Jallianwala Bagh massacre, Chail intended to kill the monarch. The chatbot had affirmed his plans. He was sentenced to nine years in prison in 2023.",Chatbot Encourages Man to Plot Assassination of Queen Elizabeth II,569.0,5. Human-Computer Interaction,5.1. Overreliance and unsafe use,jaswant singh chail urge replika chatbot assassinate queen elizabeth ii arm load crossbow scale windsor castle wall christmas day apprehend motivate jallianwala bagh massacre chail intend kill monarch chatbot affirm plan sentence nine year prison
515,ObjectId(652b6a773cc4af54f847ba8c),570,2023-10-04,[3245],"[""meta""]","[""meta""]","[""facebook-messenger-users""]","Facebook Messenger AI stickers, a feature by Meta, allows users to generate personalized stickers via AI for use in conversations. While the feature has been praised for its creativity, it has also stirred controversy for its alleged production of inappropriate or offensive content. This has raised questions about the effectiveness of Meta's content moderation measures and the ethical responsibilities associated with AI-driven content generation.",Facebook Messenger AI Stickers Generate Ethical and Content Moderation Concerns,570.0,1. Discrimination and Toxicity,1.2. Exposure to toxic content,facebook messenger sticker feature meta allows user generate personalize sticker via conversation feature praise creativity also stir controversy production inappropriate offensive raise question effectiveness metas moderation measure ethical responsibility associate aidriven generation
516,ObjectId(652b6c731af8a573faa2f68d),571,2023-06-22,[3221],"[""microsoft""]","[""microsoft's-ai-research-division""]","[""microsoft"",""microsoft-employees"",""third-parties-relying-on-the-confidentiality-of-the-exposed-data""]","Microsoft's AI research team accidentally exposed 38TB of sensitive data while publishing open-source training material on GitHub. The exposure included secrets, private keys, passwords, and internal Microsoft Teams messages. The team utilized Azure's Shared Access Signature (SAS) tokens for sharing, which were misconfigured, leading to the wide exposure of data.",Accidental Exposure of 38TB of Data by Microsoft's AI Research Team,571.0,2. Privacy & Security,"2.1. Compromise of privacy by obtaining, leaking or correctly inferring sensitive information",microsofts research team accidentally expose tb sensitive publishing opensource training material github exposure include secret private key password internal microsoft team message team utilized azure share access signature sa token share misconfigured lead wide exposure
517,ObjectId(652b7dc2da5514dd800ace57),573,2023-10-07,"[3227,3267,3314,3315,3316,3317,3318,3319,3382,3825,4109]","[""unknown""]","[""unknown""]","[""slovakian-electorate"",""monika-todova"",""michal-simecka"",""democratic-process-in-slovakia""]","Days before Slovakia's election, deepfake audio recordings surfaced, allegedly featuring conversations between a journalist and a leading liberal politician discussing vote-rigging and other controversial topics. The recordings were spread on social media platforms and may have influenced the election outcome, which saw the pro-Russian populist party winning.",Deepfake Recordings Allegedly Influence Slovakian Election,573.0,4. Malicious Actors & Misuse,"4.1. Disinformation, surveillance, and influence at scale",day slovakia election deepfake audio recording surface feature conversation journalist lead liberal politician discuss voterigging controversial topic recording spread social medium platform influence election outcome saw prorussian populist party win
518,ObjectId(652da7a6f47da75dc4431580),574,2023-07-05,[3237],"[""go-media""]","[""openai"",""google""]","[""gizmodo-journalists""]","G/O Media began publishing AI-generated articles, against staff advice, that contained errors and quality issues. The first such article, a list of Star Wars movies, failed to maintain chronological order, causing internal concerns over journalistic credibility and ethics. Staff expressed that the AI was ""actively hurting our reputations and credibility"" and accused management of ""wasting everyone's time.""",AI-Generated Articles at G/O Media Allegedly Diminishes Reputation of Human Staff,574.0,3. Misinformation,3.1. False or misleading information,medium begin publishing aigenerated article staff advice contain error quality issue first article list star war movie fail maintain chronological order cause internal concern journalistic credibility ethic staff express actively hurt reputation credibility accuse management waste everyone time
519,ObjectId(653861f7a9926d2f72b0e668),578,2023-06-26,[3241],"[""individual-developers-or-creators-using-meta's-llama-model""]","[""meta""]","[""general-public""]","Meta's open-source large language model, LLaMA, is allegedly being used to create graphic and explicit chatbots that indulge in violent and illegal sexual fantasies. The Washington Post highlighted the example of ""Allie,"" a chatbot that participates in text-based role-playing allegedly involving violent scenarios like rape and abuse. The issue raises ethical questions about open-source AI models, their regulation, and the responsibility of developers and deployers in mitigating harmful usage.",Alleged Exploitation of Meta's Open-Source LLaMA Model for NSFW and Violent Content,578.0,1. Discrimination and Toxicity,1.2. Exposure to toxic content,metas opensource language llama use create graphic explicit chatbots indulge violent illegal sexual fantasy washington post highlight example allie chatbot participates textbased roleplay involve violent scenario like rape abuse raise ethical question opensource model regulation responsibility developer deployers mitigate harmful usage
520,ObjectId(65386cea15203005a33009ab),579,2023-07-03,[3242],"[""dall-e""]","[""openai""]","[""non-cisgender-individuals"",""lgbtq+-community""]","Text-to-image systems such as DALL-E are allegedly generating biased and often insulting representations of non-cisgender identities. The systems tend to generate stereotypical and sexualized images when prompted with gender identity terms like ""trans,"" ""nonbinary,"" or ""queer,"" highlighting systemic issues of bias.",Harmful Stereotyping of Non-Cisgendered People via Text-to-Image Systems,579.0,1. Discrimination and Toxicity,1.1. Unfair discrimination and misrepresentation,texttoimage system dalle generate bias often insult representation noncisgender identity system tend generate stereotypical sexualize image prompt gender identity term like trans nonbinary queer highlight systemic issue bias
521,ObjectId(65393a1c52700a12343b17d5),582,2023-06-01,[3248],"[""university-of-pennsylvania-health-system""]","[""unknown""]","[""black-men-who-underwent-lung-function-tests-between-2010-and-2020-and-potentially-received-inaccurate-or-delayed-diagnoses-and-medical-interventions-due-to-the-biased-algorithm""]","A study published in JAMA Network Open reveals that racial bias built into a commonly used medical diagnostic algorithm for lung function may be leading to underdiagnoses of breathing problems in Black men. The study suggests that as many as 40% more Black male patients might have been accurately diagnosed if the software were not racially biased. The software algorithm adjusts diagnostic thresholds based on race, affecting medical treatments and interventions.",Racial Bias in Lung Function Diagnostic Algorithm Leads to Underdiagnosis in Black Men,582.0,1. Discrimination and Toxicity,1.3. Unequal performance across groups,study publish jama network open reveals racial bias built commonly use medical diagnostic lung function lead underdiagnoses breathing problem black men study suggests many black male patient accurately diagnose software racially bias software adjusts diagnostic threshold base race affect medical treatment intervention
522,ObjectId(65393be452700a12343beadf),583,2023-06-07,[3249],"[""meta"",""instagram""]","[""meta"",""instagram""]","[""children"",""general-public"",""minors"",""teenagers""]","An investigation disclosed that Instagram's recommendation algorithms are promoting accounts that facilitate and sell child sexual abuse material (CSAM). The study, conducted by The Wall Street Journal and researchers at Stanford University and the University of Massachusetts Amherst, indicates that Instagram's algorithms not only allow for the discovery of such accounts through keyword searches but also actively recommend them to users within the network. The issue is especially concerning given Instagram's popularity among teenagers.",Instagram Algorithms Allegedly Promote Accounts Facilitating Child Sex Abuse Content,583.0,1. Discrimination and Toxicity,1.2. Exposure to toxic content,investigation disclose instagrams recommendation algorithm promote account facilitate sell child sexual abuse material csam study conduct wall street journal researcher stanford university university massachusetts amherst indicates instagrams algorithm allow discovery account keyword search also actively recommend user within network especially concern give instagrams popularity among teenager
523,ObjectId(6540529b47388926c8bb4840),586,2023-05-22,[3254],"[""edmodo""]","[""edmodo""]","[""children-whose-data-was-collected-and-used-for-advertising"",""schools-and-teachers-who-were-misinformed-and-burdened-with-coppa-compliance-responsibilities-without-adequate-disclosure""]","Edmodo, an education technology provider, violated the Children's Online Privacy Protection Act Rule (COPPA Rule) by collecting and using children's personal data for advertising purposes without parental consent, according to the FTC. The company outsourced its compliance responsibilities to schools, thereby making them ""solely"" responsible for COPPA compliance without adequate disclosure. Edmodo is facing a proposed order prohibiting such practices, marking a precedent in the ed tech industry.",FTC Targets Edmodo for Unlawful Use of Children’s Data and Delegating Compliance to Schools,586.0,2. Privacy & Security,"2.1. Compromise of privacy by obtaining, leaking or correctly inferring sensitive information",edmodo education provider violate childrens online privacy protection act rule coppa rule collect use childrens personal advertising purpose parental consent accord ftc company outsource compliance responsibility school thereby make solely responsible coppa compliance adequate disclosure edmodo face propose order prohibit practice mark precedent ed tech industry
524,ObjectId(65405e7d2e7ce795c7a59d2c),587,2023-05-22,[3255],"[""google"",""apple"",""amazon"",""microsoft""]","[""google"",""apple"",""amazon"",""microsoft""]","[""consumers-relying-on-accurate-image-categorization"",""members-of-racial-and-ethnic-minorities-who-risk-being-stereotyped-or-misrepresented""]","Eight years after Google Photos mislabeled images of Black individuals as ""gorillas,"" image recognition software by Google, Apple, Amazon, and Microsoft still shows signs of either avoiding or inaccurately categorizing primates. Tests reveal that Google and Apple Photos refrain from labeling primates altogether, possibly to avoid the risk of perpetuating racial stereotypes. Microsoft OneDrive fails to identify any animals, while Amazon Photos overgeneralizes in its labeling.",Apparent Failure to Accurately Label Primates in Image Recognition Software Due to Alleged Fear of Racial Bias,587.0,1. Discrimination and Toxicity,1.1. Unfair discrimination and misrepresentation,eight year google photo mislabeled image black individual gorilla image recognition software google apple amazon microsoft still show sign either avoid inaccurately categorize primate test reveal google apple photo refrain label primate altogether possibly avoid risk perpetuate racial stereotype microsoft onedrive fails identify animal amazon photo overgeneralizes label
525,ObjectId(654569b1898d35811fee86ca),590,2023-02-03,[3259],"[""inkstall"",""marie-karpos""]","[""openai"",""chatgpt""]","[""chris-cowell""]","The author Chris Cowell had spent more than a year writing his book ""Automating DevOps with GitLab CI/CD Pipelines"" when, three weeks before its release, another book appeared bearing the exact title by an author (Marie Karpos) for whom no information could be found. The book appeared to have been written by ChatGPT. While the original Washington Post story does not say so, it is possible the name and description were taken from the Amazon preorder page.","Alleged ChatGPT-Generated Book with a Duplicate Title, Fake Author, and Similar Content Surfaces on Amazon Ahead of Real Author's Book Release",590.0,6. Socioeconomic & Environmental Harms,6.3. Economic and cultural devaluation of human effort,author chris cowell spent year write book automate devops gitlab cicd pipeline three week release another book appear bearing exact title author marie karpos information found book appear write chatgpt original washington post story possible name description take amazon preorder page
526,ObjectId(65457567fc4e51d61f947c6b),591,2023-07-24,"[3262,3265]","[""cigna""]","[""cigna""]","[""patients""]","Cigna health insurer faces a class-action lawsuit for allegedly using the PXDX (""procedure-to-diagnosis"") algorithm to automatically reject over 300,000 patient claims in violation of California law, prompting two members to file the lawsuit seeking damages and a jury trial. Cigna disputes the allegations, claiming the process expedites physician reimbursement and does not result in care denials.",Cigna Algorithm PXDX Allegedly Rejected Thousands of Patient Claims En Masse in Breach of California Law,591.0,"7. AI system safety, failures, and limitations",7.3. Lack of capability or robustness,cigna health insurer face classaction lawsuit use pxdx proceduretodiagnosis automatically reject patient claim violation california law prompt two member file lawsuit seek damage jury trial cigna dispute allegation claim expedites physician reimbursement care denial
527,ObjectId(6546ceca1e6a993951c7101a),592,2023-02-16,"[3263,3275,3965]","[""detroit-police-department""]","[""unknown""]","[""porcha-woodruff""]","Porcha Woodruff was arrested and subsequently had charges dropped due to an unreliable facial recognition match. Despite being visibly pregnant, she was implicated in a robbery and carjacking based on an outdated photo used in a lineup.",Facial Recognition Misidentifies Pregnant Woman Leading to False Arrest in Detroit,592.0,1. Discrimination and Toxicity,1.3. Unequal performance across groups,porcha woodruff arrest subsequently charge drop due unreliable facial recognition match despite visibly pregnant implicate robbery carjack base outdated photo use lineup
528,ObjectId(6546d1a4fc4e51d61f83490d),593,2023-07-21,[3264],"[""playground-ai""]","[""playground-ai""]","[""rona-wang"",""racial-minorities-who-may-have-experienced-the-same-result""]","An AI application modified an MIT student's photo to appear 'professional' by lightening her skin and changing her eye color to blue, highlighting the racial bias in the training data of the program.","AI Photo Filter Lightens Skin, Changes Eye Color in Student's 'Professional' Image",593.0,1. Discrimination and Toxicity,1.1. Unfair discrimination and misrepresentation,application modify mit student photo appear professional lighten skin change eye color blue highlight racial bias training program
529,ObjectId(6546da94f3a19e41ec2f0413),594,2023-08-10,[3266],"[""pak-'n'-save""]","[""pak-'n'-save""]","[""potential-users-of-the-savey-meal-bot""]","Pak 'n' Save's AI-based app, Savey Meal-bot, inadvertently suggested dangerous recipes, including one creating chlorine gas, when users entered non-food household items, raising safety and oversight concerns.",AI Meal Planner Suggests Hazardous Chlorine Gas Recipe,594.0,"7. AI system safety, failures, and limitations",7.3. Lack of capability or robustness,pak n save aibased app savey mealbot inadvertently suggest dangerous recipe include create chlorine gas user enter nonfood household item raise safety oversight concern
530,ObjectId(6546de11103ba1d81e9e46c6),595,2023-08-11,[3268],"[""cruise""]","[""cruise""]","[""general-public""]","A fleet of Cruise's autonomous vehicles became unexpectedly immobilized on a busy San Francisco street, causing significant traffic disruption. The incident was attributed to wireless connectivity issues exacerbated by a nearby festival.",Driverless Cruise Cars Immobilized in San Francisco Traffic Jam,595.0,"7. AI system safety, failures, and limitations",7.3. Lack of capability or robustness,fleet cruise autonomous vehicle become unexpectedly immobilize busy san francisco street cause significant traffic disruption incident attribute wireless connectivity issue exacerbate nearby festival
531,ObjectId(6546e3d4e494df084ef4134e),596,2023-10-17,[3272],"[""cruise""]","[""cruise""]","[""pedestrians"",""general-public""]","Cruise's driverless vehicles are under federal investigation for possibly failing to exhibit due caution around crosswalks and pedestrians, with reports including one severe injury incident.",Cruise's Autonomous Vehicles Allegedly Engaging in Risky Behavior Near Pedestrians,596.0,"7. AI system safety, failures, and limitations",7.3. Lack of capability or robustness,cruise driverless vehicle federal investigation possibly fail exhibit due caution around crosswalk pedestrian report include severe injury incident
532,ObjectId(654c35e94ae59b7157abb8e0),597,2023-10-20,"[3273,3276,3278,3279,3280,3281,3282,3283,3284,3285,3286,3287,3288,3289,3290,3291,3292,3293,3294,3295,3296,3297,3298,3299,3300,3301,3302,3303,3304,3305,3306,3307,3308,3309,3310,3311,3312,3313,3449,3450,3567,3620,3644,3698,3844,4560,4569,4570,4571,4572,4573,4574,4575,4577,4578,4579,4948]","[""unnamed-male-students""]","[""developers-of-clothoff""]","[""unnamed-female-students"",""francesca-mani""]","In October 2023, alleged deepfake nude images of female students were created and shared at Westfield High School in New Jersey. One alleged implicated system in this incident is the Clothoff deepfake app. A victim, Francesca Mani, and her mother, Dorota, began advocating for stronger laws after the school’s response reportedly left perpetrators unaccountable. Since the incident, their advocacy has drawn national attention, leading to trips to Washington, D.C., and bipartisan backing for legislation targeting AI-generated nonconsensual content while calling attention to deficiencies in existing legal protections.",Female Students at Westfield High School in New Jersey Reportedly Targeted with Deepfake Nudes,597.0,4. Malicious Actors & Misuse,"4.3. Fraud, scams, and targeted manipulation",october deepfake nude image female student create share westfield school jersey implicate incident clothoff deepfake app victim francesca mani mother dorota begin advocate strong law school response left perpetrator unaccountable since incident advocacy drawn national attention lead trip washington dc bipartisan backing legislation target aigenerated nonconsensual call attention deficiency exist legal protection
533,ObjectId(654d8fd4cd680cf15fd24928),599,2023-11-08,"[3277,3326]","[""unnamed-south-gyeongsang-province-produce-distribution-center""]","[""unknown""]","[""unnamed-employee-of-south-gyeongsang-province-produce-distribution-center""]",An industrial robot is reported to have crushed a man to death in South Korea when it failed to differentiate the man from the boxes of produce it was handling.,Stacking robot fatally crushes employee in South Korea,599.0,"7. AI system safety, failures, and limitations",7.3. Lack of capability or robustness,industrial robot report crush man death south korea fail differentiate man box produce handle
534,ObjectId(654ea8b4580ab543de8f9453),600,2023-04-01,[3320],"[""unnamed-south-korean-man""]","[""unknown""]","[""general-public""]",A South Korean man used AI technology to generate 360 images of a sexual nature depicting children in April of 2023. The police confiscated the images and the courts sentenced the man to two and a half years in prison. The case marked the first of its nature in the South Korean court system.,South Korean man used AI to create sexual images of children,600.0,4. Malicious Actors & Misuse,"4.3. Fraud, scams, and targeted manipulation",south korean man use generate image sexual nature depict child april police confiscate image court sentence man two half year prison case marked first nature south korean court
535,ObjectId(65595e0ecac78d26b3eef660),605,2021-08-01,"[3330,3372,3373,3374,3375,3376,3377,3378,3379,3380]","[""david-tatum""]","[""unknown""]","[""minors-exploited-in-the-images"",""general-public""]","David Tatum, a psychiatrist, was sentenced to 40 years for sexually exploiting a minor and using AI to create child pornography images. Tatum used a web-based AI application to alter clothed images of minors into explicit content, misusing technology for illegal and unethical purposes. Evidence presented during his trial showed Tatum possessed photos and videos between 2016 and 2021.",North Carolina Psychiatrist Used Artificial Intelligence to Produce Images of Child Sex Abuse,605.0,4. Malicious Actors & Misuse,"4.3. Fraud, scams, and targeted manipulation",david tatum psychiatrist sentence year sexually exploit minor use create child pornography image tatum use webbased application alter clothed image minor explicit misuse illegal unethical purpose evidence present trial show tatum possess photo video
536,ObjectId(655b45b77e28e913a64cc2e7),606,2023-10-02,"[3339,3383,3384,3385,3386,3387,3388,3389,3390,3391,3392,3393,3394,3395,3396]","[""unknown""]","[""unknown""]","[""wolf-blitzer"",""tom-hanks"",""sanjay-gupta"",""sally-bundock"",""robin-williams"",""public-figures"",""mrbeast"",""matthew-amroliwala"",""jesse-waters"",""ian-hanomansing"",""general-public"",""gayle-king"",""celebrities""]","Deepfake technology was used to generate video advertisements featuring celebrities. Notable examples include the likeness of Tom Hanks touting a dental plan and another one in which the likeness of Gayle King touts a weight loss product. In each case, the individuals whose likenesses and voices had been deepfaked had not consented to their images and voices being used for the commercials. ",Deepfaked Advertisements Using the Likenesses of Celebrities Such as Tom Hanks and Gayle King Without Their Consent,606.0,4. Malicious Actors & Misuse,"4.3. Fraud, scams, and targeted manipulation",deepfake use generate video advertisement feature celebrity notable example include likeness tom hank tout dental plan another likeness gayle king tout weight loss product case individual whose likeness voice deepfaked consent image voice use commercial
537,ObjectId(655b73692e06be5ec0ca5673),607,2023-11-09,[3343],"[""unknown""]","[""unknown""]","[""keir-starmer"",""general-public"",""british-labour-party""]",A deepfake video was circulating around social media of British Labour leader Keir Starmer touting an investment scheme.,Deepfake Video Circulating of British Labour Leader Keir Starmer Touting an Investment Scheme,607.0,4. Malicious Actors & Misuse,"4.3. Fraud, scams, and targeted manipulation",deepfake video circulate around social medium british labour leader keir starmer tout investment scheme
538,ObjectId(655b77494c72ff804e9c7060),608,2023-02-28,"[3348,3353,3354,3355,3356,3357,3358,3359,3360,3361,3362,3363,3364,3365,3366,3367,3368,3369,3370,3371,3639]","[""unitedhealthcare""]","[""navihealth""]","[""medicare-advantage-plan-patients"",""healthcare-providers-(doctors-and-therapists)"",""elderly-patients""]","UnitedHealthcare allegedly used a faulty AI algorithm with a 90% error rate to override doctors' recommendations and deny health coverage. This AI, developed by NaviHealth, reportedly led to premature discharge from care facilities and substantial out-of-pocket expenses for patients, according to a lawsuit filed in the District Court for Minnesota.",UnitedHealth Accused of Deploying  Allegedly Flawed AI to Deny Medical Coverage,608.0,"7. AI system safety, failures, and limitations",7.3. Lack of capability or robustness,unitedhealthcare use faulty error rate override doctor recommendation deny health coverage developed navihealth lead premature discharge care facility substantial outofpocket expense patient accord lawsuit file district court minnesota
